{
  "tesserae_compat": "1.x",
  "id": "visionect_v_tablet_9_7",
  "name": "Visionect 9.7\" board",
  "vendor": "Visionect",
  "url": "https://www.visionect.com/",
  "icon": "frame-corners",
  "description": "Visionect 9.7\" e-paper boards (V-Tablet and similar), 1200x825 with 16 grey levels, driven over the Visionect protocol on TCP 11113 with no Visionect Software Suite.",
  "protocol": "visionect",
  "renderers": [
    "trmnl_png_gray16"
  ],
  "panel": {
    "w": 1200,
    "h": 825,
    "orientation": "landscape",
    "name": "Visionect 9.7\" e-paper, 16-level greyscale",
    "gamut": "gray_16",
    "native_w": 1200,
    "native_h": 825
  },
  "refresh_floor_s": 60,
  "image_format": "png",
  "notes_md": "UNVERIFIED ON HARDWARE: the protocol and this panel geometry come from pyvisionect, which was verified on the 32\" sign only. The sign reports its own display type on connect and Tesserae adopts that buffer size, so a mismatch here corrects itself. Point the sign at Tesserae on TCP 11113 (the old Visionect server's address, or over its USB console with `server_tcp_set`)."
}
