{
  "tesserae_compat": "1.x",
  "id": "visionect_place_and_play_13",
  "name": "Visionect Place & Play 13\"",
  "vendor": "Visionect",
  "url": "https://www.visionect.com/",
  "icon": "frame-corners",
  "description": "Visionect's 13.3\" e-paper sign, 1600x1200 with 16 grey levels, driven over its own protocol on TCP 11113 with no Visionect Software Suite.",
  "protocol": "visionect",
  "renderers": [
    "trmnl_png_gray16"
  ],
  "panel": {
    "w": 1600,
    "h": 1200,
    "orientation": "landscape",
    "name": "Visionect 13.3\" e-paper, 16-level greyscale",
    "gamut": "gray_16",
    "native_w": 1600,
    "native_h": 1200
  },
  "buttons": false,
  "touch": false,
  "refresh_floor_s": 60,
  "image_format": "png",
  "notes_md": "UNVERIFIED ON HARDWARE: the protocol and this panel geometry come from pyvisionect, which was verified on the 32\" sign only. The sign reports its own display type on connect and Tesserae adopts that buffer size, so a mismatch here corrects itself. Point the sign at Tesserae on TCP 11113 (the old Visionect server's address, or over its USB console with `server_tcp_set`)."
}
